Name & Organization,Attachments,Document Title,Description,Technical Area,Indicator,Document Type,Author,Publication Date,WHO-Approved Doc: Check here if this document peer reviewed or from the WHO or CDC,Status,Relevant Pages,Lead Approval Req: Check here if this document requires approval from another lead agency,Thumbnail Image
Michael Mahar,Hazim Ethiopia AMR Surveillance.pdf (https://dl.airtable.com/.attachments/7db0812500c513bb055fe551030f0d84/b9d0e9bb/HazimEthiopiaAMRSurveillance.pdf),Establishment of a Sentinel Laboratory-Based Antimicrobial Resistance Surveillance Network in Ethiopia,Description of establishment of an AMR sentinel surveillance system in Ethiopia.,Antimicrobial Resistance,3.2 Initiate AMR surveillance at pilot or representative regional and referral hospitals.,Guideline,Hazim et al.,2018,checked,,All,,Hazim Ethiopia AMR Surveillance.png (https://dl.airtable.com/.attachments/5eaacdc47b1401fa8ff87cf373cb6474/ebb914f1/HazimEthiopiaAMRSurveillance.png)
Britney McMurren,A Manual for Developing National Action Plans_eng.pdf (https://dl.airtable.com/.attachments/cdde198184112f21a3f6cb54721669c9/78b9663d/AManualforDevelopingNationalActionPlans_eng.pdf),Antimicrobial Resistance: A Manual for Developing National Action Plans,"This manual for developing national action plans to address antimicrobial resistance has been developed at the request of the World Health Assembly to assist countries in the initial phase of developing new, or refining existing national action plans in line with the strategic objectives of the Global Action Plan. It proposes an incremental approach that countries can adapt to the specific needs, circumstances and available resources of each individual country. Details of actions to be taken will vary according to national contexts.",Antimicrobial Resistance,"3.1 Develop a plan of action to address AMR in line with the Global Action Plan (GAP) on AMR.,""3.1 Undertake a situation analysis to identify major risks for development and transmission of AMR, and where the impact of
resistance would be greatest.""",Manual,World Health Organization,2016,checked,,"All, 9-12",,A Manual for Developing National Action Plans_eng.png (https://dl.airtable.com/.attachments/3aa3321414646f01ebcd7ccc776c62be/18873256/AManualforDevelopingNationalActionPlans_eng.png)
Britney McMurren,AMS Toolkit_Eng.pdf (https://dl.airtable.com/.attachments/16400640c2b8abf305043934722d0a6f/239bacdd/AMSToolkit_Eng.pdf),Antimicrobial Stewardship Programmes in Health-care Facilities in Low- and Middle-Income Countries: A WHO Practical Toolkit,The specific aim of the toolkit is to enable antimicrobial stewardship in health-care facilities in low- and middle-income countries.,Antimicrobial Resistance,"""3.4 Implement antimicrobial stewardship programmes, including monitoring of antimicrobial use, education/communication, and other interventions to improve antibiotic use, at designated facilities."",3.4 Measure antibiotic use and assess appropriateness. 3.4 Implement stewardship practices at designated healthcare facilities.,3.4 Continue to monitor antimicrobial stewardship activities and update the national stewardship plan on a timely basis and publicly report on the results.,3.4 Expand antimicrobial stewardship activities to all healthcare facilities.,""3.4 Monitor and evaluate stewardship programmes conducted, including the analysis of antimicrobial use data."",""3.4 Develop a draft national antimicrobial stewardship plan or strategy and national legislation that regulate use, availability and quality of antimicrobials."",""3.4 Undertake an assessment of stewardship policies and activities, including regulatory framework and supply chain management of antimicrobials, using a multisectoral approach."",3.4 Implement stewardship practices at designated healthcare facilities.",Tool,World Health Organization ,2019,checked,,All,,AMS Toolkit_Eng.png (https://dl.airtable.com/.attachments/e7498e320b5151eb4c32b9b86ac0cfec/b1c0396a/AMSToolkit_Eng.png)
Michael Mahar,National Action Plan on Prevention and Containment of AMR-Kenya.pdf (https://dl.airtable.com/.attachments/406111d7cc193c527222382b4427bbbe/8a0d63b1/NationalActionPlanonPreventionandContainmentofAMR-Kenya.pdf),Government of Kenya National Action Plan on Prevention and Containment of Antimicrobial Resistance 2017-2022,National action plan for prevention and containment of AMR from Kenya.,Antimicrobial Resistance,3.1 Develop a plan of action to address AMR in line with the Global Action Plan (GAP) on AMR.,Example,Government of Kenya,2017,,,All,,National Action Plan on Prevention and Containment of AMR-Kenya.png (https://dl.airtable.com/.attachments/33cec44eefdbf82f0e0e791be9d28643/a034803c/NationalActionPlanonPreventionandContainmentofAMR-Kenya.png)
Michael Mahar,AMR18_National Action Plan on AMR (India).pdf (https://dl.airtable.com/.attachments/b23f854542786e00fd996fc6dbc85370/c4be5fb2/AMR18_NationalActionPlanonAMRIndia.pdf),National Action Plan on Antimicrobial Resistance: Government of India,AMR national action plan from India.,Antimicrobial Resistance,3.1 Develop a plan of action to address AMR in line with the Global Action Plan (GAP) on AMR.,Example,Government of India,2017,,,All,,AMR18_National Action Plan on AMR (India).png (https://dl.airtable.com/.attachments/e5c054c01ba925dd42a1649ddf75f746/2aa90c40/AMR18_NationalActionPlanonAMRIndia.png)
Mike Mahar,AMR6b_Sample conceptual ME framework for NAP.pdf (https://dl.airtable.com/.attachments/ba33bffd1fa8fff512d401da266e621a/0b8e1c28/AMR6b_SampleconceptualMEframeworkforNAP.pdf),Sample conceptual monitoring and evaluation framework for national action plans on antimicrobial resistance,Sample conceptual monitoring and evaluation framework for NAPs on antimicrobial resistance,Antimicrobial Resistance,3.1 Develop and implement an AMR national action plan monitoring framework.,Example,World Health Organization ,2016,checked,,1,checked,AMR6b_Sample conceptual ME framework for NAP.png (https://dl.airtable.com/.attachments/141a5946f122464fbb1bc63cd425b9e6/10fd5c59/AMR6b_SampleconceptualMEframeworkforNAP.png)
Mike Mahar,global monitoring of country progress on AMR (country self assessment questionnaire)-2016.pdf (https://dl.airtable.com/.attachments/6c9a3ff3903924324bf1d235094ffc2a/caeb9e63/globalmonitoringofcountryprogressonAMRcountryselfassessmentquestionnaire-2016.pdf),"Global Monitoring of Country Progress on Antimicrobial Resistance (AMR):
Country self-assessment questionnaire",Global monitoring of country progress on AMR (self-assessment) - This questionnaire collects information oncountry progress on AMR for inclusion in the report to the World Health Assembly and for other organizations’ global reporting. ,Antimicrobial Resistance,3.1 Develop and implement an AMR national action plan monitoring framework.,Tool,World Health Organization ,2016,checked,,3-7,checked,global monitoring of country progress on AMR (country self assessment questionnaire)-2016.png (https://dl.airtable.com/.attachments/bdceacbec7e30eaad3c9c864b52e6bbc/251ac5f9/globalmonitoringofcountryprogressonAMRcountryselfassessmentquestionnaire-2016.png)
"Britney McMurren, WHO",Tackling-AMR-multisectoral-coordination-june2018.pdf (https://dl.airtable.com/.attachments/d2510b88aeb9caddfd1961a55464430e/0726faa8/Tackling-AMR-multisectoral-coordination-june2018.pdf),Tackling Antimicrobial Resistance (AMR) Together: Working Paper 1.0 Multisectoral coordination,,Antimicrobial Resistance,"3.1 Establish a national multisectoral AMR coordinating committee.,3.1 Organize effective coordination through regular meetings.,3.1 Review plans and progress through regular meetings of the AMR governance committee.",Guideline,World Health Organization,2018,checked,,"All, 14-15, 16-19",,Tackling-AMR-multisectoral-coordination-june2018.png (https://dl.airtable.com/.attachments/1071ee091bb8447c516276007eda7737/d9ddc1f1/Tackling-AMR-multisectoral-coordination-june2018.png)
"Britney McMurren, WHO",Multidisciplinary and multisectoral coalitions as catalysts for action against antimicrobial resistance .pdf (https://dl.airtable.com/.attachments/200b257774f62d5afbcc5e4c233ecd5e/90e8582c/Multidisciplinaryandmultisectoralcoalitionsascatalystsforactionagainstantimicrobialresistance.pdf),"Multidisciplinary and multisectoral coalitions
as catalysts for action against antimicrobial
resistance: Implementation experiences at
national and regional levels",,Antimicrobial Resistance,3.1 Establish a national multisectoral AMR coordinating committee.,Example,Mohan Joshi et al.,2018,checked,,All,,Multidisciplinary and multisectoral coalitions as catalysts for action against antimicrobial resistance .png (https://dl.airtable.com/.attachments/7c389bb85bc177868599cd69acaf5bb5/a52bdc81/Multidisciplinaryandmultisectoralcoalitionsascatalystsforactionagainstantimicrobialresistance.png)
"Britney McMurren, WHO",AMR-Turning-plans-into-action-working-paper-march-2019.pdf (https://dl.airtable.com/.attachments/5a925e417602c0b2b9fdb0b0ff35aba8/c37fa305/AMR-Turning-plans-into-action-working-paper-march-2019.pdf),"Turning Plans Into Action for Antimicrobial Resistance (AMR): 
Working Paper 2.0 Implementation
and coordination","This paper was developed to support AMR coordination committees and others tasked with addressing AMR at country level. Drawing on the published literature and the operational experience and expertise of different low- and middle-income countries, the paper points to six key strategies for success and offers a series of practical tips and suggestions on how to implement each one. ",Antimicrobial Resistance,"3.1 Identify programmes and activities relating to key AMR objectives that need to be developed or scaled up.,""3.1 Identify priority actions (based on risk and feasibility) from the national action plan, develop an implementation plan with
responsible agencies with established timelines, and begin implementation of these actions."",3.1 Ensure key activities are incorporated in plans and budgets of relevant programmes and agencies.",Guideline,World Health Organization,2019,checked,,"7-14, 23-25",,AMR-Turning-plans-into-action-working-paper-march-2019.png (https://dl.airtable.com/.attachments/72786635d3c0a9010421e6c300c4de44/da8de503/AMR-Turning-plans-into-action-working-paper-march-2019.png)
"Britney McMurren, WHO",Antibiotic Resistance in Vietnam_ Moving towards a One Health Surveillance System.pdf (https://dl.airtable.com/.attachments/eb4e23f2f198383286850b8998b7aec9/63fe4074/AntibioticResistanceinVietnam_MovingtowardsaOneHealthSurveillanceSystem.pdf),"Antibiotic resistance in Vietnam: moving
towards a One Health surveillance system",,Antimicrobial Resistance,"""3.1 Undertake a situation analysis to identify major risks for development and transmission of AMR, and where the impact of
resistance would be greatest.""",Case Study,Marion Bordier et al.,2018,checked,,All,,Antibiotic Resistance in Vietnam_ Moving towards a One Health Surveillance System.png (https://dl.airtable.com/.attachments/76bfd54492a59426eb656987d095133c/47ba26e4/AntibioticResistanceinVietnam_MovingtowardsaOneHealthSurveillanceSystem.png)
"Britney McMurren, WHO",MSG TOR-English.pdf (https://dl.airtable.com/.attachments/eac46b6bbde4780984586e6883b5aca8/c0367f3d/MSGTOR-English.pdf),"Sample terms of reference for a national multisectoral
coordinating group, for a national focal point and for a
technical working group","Sample terms of reference for a national multisectoral coordinating group, for a national focal point and for a technical working group.",Antimicrobial Resistance,"""3.1 Identify a health ministry lead for AMR, develop a clear terms of reference and coordinate activities of the relevant ministries
on AMR and stewardship."",""3.1 Develop terms of reference for a multisectoral governance mechanism, with clear lines of accountability between the AMR
coordinating committee and the high level One Health group.""",Example,"WHO, FAO, OIE",2016,checked,,1-5,,MSG TOR-English.png (https://dl.airtable.com/.attachments/4d19d382646c17f7d17933ae935b43af/3351474f/MSGTOR-English.png)
"Britney McMurren, WHO",GARDP Situation Analysis and Recommendations_Kenya.pdf (https://dl.airtable.com/.attachments/5d295bef398d5e0f882169648df97f82/04506ef1/GARDPSituationAnalysisandRecommendations_Kenya.pdf),Situation Analysis and Recommendations: Antibiotic Use and Resistance in Kenya,,Antimicrobial Resistance,"""3.1 Undertake a situation analysis to identify major risks for development and transmission of AMR, and where the impact of
resistance would be greatest.""",Case Study, Global Antibiotic Resistance Partnership — Kenya Working Group,2011,checked,,All,,GARDP Situation Analysis and Recommendations_Kenya.png (https://dl.airtable.com/.attachments/f253531e2fd5e1778d9f35800f9c1255/18387ef3/GARDPSituationAnalysisandRecommendations_Kenya.png)
"Britney McMurren, WHO",Sample NAP Template.pdf (https://dl.airtable.com/.attachments/98a535a2235e604da812318f7e298246/e741bbb1/SampleNAPTemplate.pdf),"Sample Template: National Action Plan
on Antimicrobial Resistance",,Antimicrobial Resistance,"""3.1 Identify a health ministry lead for AMR, develop a clear terms of reference and coordinate activities of the relevant ministries
on AMR and stewardship."",3.1 Develop a plan of action to address AMR in line with the Global Action Plan (GAP) on AMR.",Template,"WHO, FAO, OIE",2016,checked,,All,,SampleNAPTemplate.png (https://dl.airtable.com/.attachments/50968d7d1adf6a47f61666b68a35e4e7/305e3b36/SampleNAPTemplate.png)
"Britney McMurren, WHO",Manual for Developing NAPs_WHOFAOOIE_eng.pdf (https://dl.airtable.com/.attachments/0a03502e548b957fe26a0101dcdf5dd7/aa7af6b8/ManualforDevelopingNAPs_WHOFAOOIE_eng.pdf),"Antimicrobial Resistance: A Manual for Developing National Action Plans
",,Antimicrobial Resistance,3.1 Develop a plan of action to address AMR in line with the Global Action Plan (GAP) on AMR.,Manual,"WHO, FAO, OIE",2016,checked,,All,,Manual for Developing NAPs_WHOFAOOIE_eng.png (https://dl.airtable.com/.attachments/7e039e2aedf4db45e07bc2ec9579409a/cec34c33/ManualforDevelopingNAPs_WHOFAOOIE_eng.png)
"Britney McMurren, WHO",NAP Development Sample-Checklist-Revised.pdf (https://dl.airtable.com/.attachments/654fec7ad36a3283d9e41a4048346c28/775e26bc/NAPDevelopmentSample-Checklist-Revised.pdf),National Action Plan development support tools: Sample Checklist,,Antimicrobial Resistance,3.1 Develop a plan of action to address AMR in line with the Global Action Plan (GAP) on AMR.,Tool,"WHO, FAO, OIE",2016,checked,,All,,NAP Development Sample-Checklist-Revised.png (https://dl.airtable.com/.attachments/447021f72161a7c25dd70299c3c02563/06132b28/NAPDevelopmentSample-Checklist-Revised.png)
"Britney McMurren, WHO",NAP M&E Framework-eng.pdf (https://dl.airtable.com/.attachments/84bf0df25ad5bf6108edb1b044637185/33ba5f73/NAPMEFramework-eng.pdf),Monitoring and Evaluation of the Global Action Plan on Antimicrobial Resistance: Framework and Recommended Indicators,,Antimicrobial Resistance,3.1 Develop and implement an AMR national action plan monitoring framework.,Guideline,"WHO, FAO, OIE",2019,checked,,All,,NAP M&E Framework-eng.png (https://dl.airtable.com/.attachments/a7c1912028d149a5c0f648c4e1f11bf2/d8829c6e/NAPMEFramework-eng.png)
"Britney McMurren, WHO",Ghana-AMR-integration-report-WHO-June-2018 (1).pdf (https://dl.airtable.com/.attachments/594775a947d5047183e721c7e192789b/3e1c2ea5/Ghana-AMR-integration-report-WHO-June-20181.pdf),"Resource mobilisation for
antimicrobial resistance
(AMR): Getting AMR into plans
and budgets of government
and development partners,
Ghana country level report",,Antimicrobial Resistance,3.1 Ensure key activities are incorporated in plans and budgets of relevant programmes and agencies.,Case Study,World Health Organization,2018,checked,,All,,Ghana-AMR-integration-report-WHO-June-2018 (1).png (https://dl.airtable.com/.attachments/f4708a3722247055d4c12453c54973ed/b1b540ae/Ghana-AMR-integration-report-WHO-June-20181.png)
"Britney McMurren, WHO",Nigeria-AMR-country-level-report-WHO-March-2018.pdf (https://dl.airtable.com/.attachments/9850f83176d0c3c4cf97dd1c0fc5b072/bdcc5e7a/Nigeria-AMR-country-level-report-WHO-March-2018.pdf),"Resource mobilisation for
antimicrobial resistance
(AMR): Getting AMR into plans
and budgets of government
and development partners,
Nigeria country level report",,Antimicrobial Resistance,3.1 Ensure key activities are incorporated in plans and budgets of relevant programmes and agencies.,Case Study,World Health Organization,2018,checked,,All,,Nigeria-AMR-country-level-report-WHO-March-2018.png (https://dl.airtable.com/.attachments/5737de7c8d4334f41ea8d229ad5b2bec/3c4d30ee/Nigeria-AMR-country-level-report-WHO-March-2018.png)
"Britney McMurren, WHO",Nepal-AMR-integration-Report-WHO-Sept-2018.pdf (https://dl.airtable.com/.attachments/acfd358bf3451801754f17d1aff92ebe/b054f633/Nepal-AMR-integration-Report-WHO-Sept-2018.pdf),"Resource mobilisation for
antimicrobial resistance
(AMR): Getting AMR into plans
and budgets of government
and development partners,
Nepal country level report",,Antimicrobial Resistance,3.1 Ensure key activities are incorporated in plans and budgets of relevant programmes and agencies.,Case Study,World Health Organization,2018,checked,,All,,Nepal-AMR-integration-Report-WHO-Sept-2018.png (https://dl.airtable.com/.attachments/8a96257f1c059341e2d9b62f26486d4f/8a87bb0c/Nepal-AMR-integration-Report-WHO-Sept-2018.png)
"Britney McMurren, WHO",WHO EML 21st Edition-eng.pdf (https://dl.airtable.com/.attachments/72b6f71a291cb80c47f5e7094ca8d3eb/16a47eef/WHOEML21stEdition-eng.pdf),"World Health Organization
Model List of Essential Medicines: 21st List",,Antimicrobial Resistance,"3.4 Review the essential medicines list and clinical guidelines that promote appropriate use.,3.4 Develop and implement legislation on �prescription only� sales of key antibiotics.",Tool,World Health Organization,2019,checked,,8-15,,WHO EML 21st Edition-eng.png (https://dl.airtable.com/.attachments/aa480bc6b190e78c28b40b8471337290/15942184/WHOEML21stEdition-eng.png)
"Britney McMurren, WHO",Antibiotic Use In SouthEast Asia.full.pdf (https://dl.airtable.com/.attachments/f4ceed982962b8c4057dead75c47deb6/e7459e9d/AntibioticUseInSouthEastAsia.full.pdf),"Antibiotic use in South East Asia and policies to
promote appropriate use: reports from country
situational analyses",,Antimicrobial Resistance,3.4 Assess existing monitoring of antimicrobial use and consumption.,Case Study,Kathleen Holloway et al. ,2017,checked,,All,,Antibiotic Use In SouthEast Asia_full.png (https://dl.airtable.com/.attachments/e04de6858ee62a9fef2a718f042d9c5c/afc5a35b/AntibioticUseInSouthEastAsia_full.png)
"Britney McMurren, WHO",The Selection and Use of Essential Medicines.pdf (https://dl.airtable.com/.attachments/1ff14037d66be4b23d5c7099b40e0f6f/b6f47bc3/TheSelectionandUseofEssentialMedicines.pdf),"The Selection and Use
of Essential Medicines",,Antimicrobial Resistance,3.4 Review the essential medicines list and clinical guidelines that promote appropriate use.,Guideline,World Health Organization,2017,checked,,62-142,,The Selection and Use of Essential Medicines.png (https://dl.airtable.com/.attachments/285c20922c852aa28c4b6afc8fbc76e9/58be09dc/TheSelectionandUseofEssentialMedicines.png)
"Britney McMurren, WHO",WHO-EMP-IAU-2019.11-eng.xlsx (https://dl.airtable.com/.attachments/ef2119e37fcdcf9745f8d0a247bec3bb/8ce575bd/WHO-EMP-IAU-2019.11-eng.xlsx),"The 2019 WHO AWaRe classification of antibiotics for evaluation and monitoring of use. 
",,Antimicrobial Resistance,"""3.4 Develop/update and disseminate national stewardship and clinical/treatment guidelines that include the Essential
Medicines List AWaRe (Access, Watch, Reserve) categorization for antibiotics promoting appropriate use of antimicrobials.""",Tool,World Health Organization,2019,checked,,All,,
"Britney McMurren, WHO",WHO_AMCsurveillance_1.0.pdf (https://dl.airtable.com/.attachments/b235587717d23e81af6d35b71a01a42a/b0859f3e/WHO_AMCsurveillance_1.0.pdf),"WHO Methodology for a Global
Programme on Surveillance of
Antimicrobial Consumption",,Antimicrobial Resistance,"""3.4 Establish SOPs, protocols and databases for monitoring antimicrobial use in humans and animals.""",Manual,World Health Organization,Unknown,checked,,All,,WHO_AMCsurveillance_1_0.png (https://dl.airtable.com/.attachments/d8b40d0c483cf608852305513de10c18/a835d367/WHO_AMCsurveillance_1_0.png)
"Britney McMurren, WHO",WHO-EMP-IAU-2018.01-eng.pdf (https://dl.airtable.com/.attachments/78067dd3a86c512cdd7d6273d89f38a4/14a4e460/WHO-EMP-IAU-2018.01-eng.pdf),"WHO Methodology for Point Prevalence Survey
on Antibiotic Use in Hospitals",,Antimicrobial Resistance,"""3.4 Implement antimicrobial stewardship programmes, including monitoring of antimicrobial use, education/communication,
and other interventions to improve antibiotic use, at designated facilities.""",Manual,World Health Organization,2018,checked,,All,,WHO-EMP-IAU-2018_01-eng.png (https://dl.airtable.com/.attachments/0de6f845236b9eab75bbbbe41a7db007/3a494b42/WHO-EMP-IAU-2018_01-eng.png)
"Britney McMurren, WHO",9789241515528-eng.pdf (https://dl.airtable.com/.attachments/d64f0f16fcb92adf37daf3b7a54bbff8/31cc73a8/9789241515528-eng.pdf),Critically Important Antimicrobials for Human Medicine,CIA List,Antimicrobial Resistance,3.4 Recommend and implement the phasing out of antimicrobials used as animal growth promotion.,Guideline,World Health Organization,2019,checked,,All,,9789241515528-eng.png (https://dl.airtable.com/.attachments/89c11a97e76d295162cb50046a43a6ed/bbe3717e/9789241515528-eng.png)
"Britney McMurren, WHO",Operational Principles for Good Pharmaceutical Management.pdf (https://dl.airtable.com/.attachments/2bf39ed749be6a2619e44f411d959696/3897c77a/OperationalPrinciplesforGoodPharmaceuticalManagement.pdf),"Operational principles
for good
pharmaceutical
procurement
",,Antimicrobial Resistance,"""3.4 Approve and enact legislation and regulations on import, marketing authorization, production and use of antimicrobials.""",Guideline,World Health Organization,1999,checked,,9-17,,Operational Principles for Good Pharmaceutical Management.png (https://dl.airtable.com/.attachments/042443163644db1e15694aabd0b6a19c/e76ed342/OperationalPrinciplesforGoodPharmaceuticalManagement.png)
"Britney McMurren, WHO",WHO List_EML_Children_7th.pdf (https://dl.airtable.com/.attachments/51862d8897729d82271acb9e9462082c/cc8f474f/WHOList_EML_Children_7th.pdf),"World Health Organization
Model List of Essential Medicines
for Children: 7th List",,Antimicrobial Resistance,3.4 Review the essential medicines list and clinical guidelines that promote appropriate use.,Guideline,World Health Organization,2019,checked,,8-15,,WHO List_EML_Children_7th.png (https://dl.airtable.com/.attachments/bc9022207968d35c95a0eecc469768d3/f910cd96/WHOList_EML_Children_7th.png)
MIchael Mahar,Zoonotic Disease Prioritization for Inter-sectoral Engagement in Cameroon.pdf (https://dl.airtable.com/.attachments/6c676d2c8fea947ce47fa629f350899d/93a91be1/ZoonoticDiseasePrioritizationforInter-sectoralEngagementinCameroon.pdf),"Zoonotic Disease
Prioritization for
Inter-sectoral
Engagement in
Cameroon","Summary of the methodology, process and results from a zoonotic diasease prioritization in Cameroon.",Zoonotic Disease,"""4.1 Jointly define and prioritize zoonotic diseases of greatest national public health concern for the country through a One
Health approach that involves all relevant stakeholders.""",Example,Government of Cameroon,2016,,,All,,Zoonotic Disease Prioritization for Inter-sectoral Engagement in Cameroon.png (https://dl.airtable.com/.attachments/6099082df6b18612b2951efd2d37789f/33b6ebc5/ZoonoticDiseasePrioritizationforInter-sectoralEngagementinCameroon.png)
Michael Mahar,uganda-one-health-zoonotic-disease-prioritization-report-508.pdf (https://dl.airtable.com/.attachments/59ff7519e7205f6c0f8d9b33e38b4219/05c91378/uganda-one-health-zoonotic-disease-prioritization-report-508.pdf),"One Health Zoonotic
Disease Prioritization
for Multi-Sectoral
Engagement in Uganda","Summary of the methodology, process, and results of a zoonotic disease prioritization workshop in Uganda.",Zoonotic Disease,"""4.1 Jointly define and prioritize zoonotic diseases of greatest national public health concern for the country through a One
Health approach that involves all relevant stakeholders.""",Example,Government of Uganda,2017,,,All,,uganda-one-health-zoonotic-disease-prioritization-report-508.png (https://dl.airtable.com/.attachments/10e2e1a748618e95a8e738d14b1e9e83/a6d8635a/uganda-one-health-zoonotic-disease-prioritization-report-508.png)
"Dawn Mapatano, CDC ",One Health Planning Workshop-Tanzania.pdf (https://dl.airtable.com/.attachments/12bfa252adfc67f39d5f1a01ee45a9de/82db658d/OneHealthPlanningWorkshop-Tanzania.pdf),"One Health Zoonotic
Disease Prioritization for
Multisectoral Engagement
in Tanzania",Country specific zoonotic disease prioritization workshop reports from Tanzania ,Zoonotic Disease,"""4.1 Jointly define and prioritize zoonotic diseases of greatest national public health concern for the country through a One
Health approach that involves all relevant stakeholders.""",Example,"US Department of Health and Human Services, CDC, USAID ",2017,,,15-18,checked,One Health Planning Workshop-Tanzania.png (https://dl.airtable.com/.attachments/b6f358d1168f8c36400a791ce5d6c384/20b287cb/OneHealthPlanningWorkshop-Tanzania.png)
