"Hani Mahmoud, RTSL",12909_2018_Article_1163.pdf (https://dl.airtable.com/.attachments/ebd2758cf90d4f0a0fbcf32c543b8d19/cb98ee5e/12909_2018_Article_1163.pdf),"What should the African health workforce know about disasters? Proposed
competencies for strengthening public health disaster risk management education in Africa","This article presents competencies and training curricula that were identified through a collaboration between the World Health Organization and WHO-AFRO, describes the stages of their development, and proposes recommendations for their completion and integration into the curricula of African public health training institutions.",Human Resources,10.3 Identify and address training needs for various professions/cadres.,Guideline,"Olu O, Usman A, Kalambay K, et al",2018,checked,,All,checked,12909_2018_Article_1163.png (https://dl.airtable.com/.attachments/4f951d9daf182b4de086579b2a67e78d/46b9f87e/12909_2018_Article_1163.png)
"Hani Mahmoud, RTSL",BF03391627.pdf (https://dl.airtable.com/.attachments/63e9262a2b3cd088729382fb30117dcf/29fc6359/BF03391627.pdf),"Training the Global Public Health Workforce Through Applied Epidemiology Training Programs: CDC’s Experience, 1951–2011",This article describes the long history and experiences of the U.S. CDC in developing training programs for field epidemiologists and also describes more recent efforts to strengthen the competencies of different cadres of public health staff.,Human Resources,"""10.4 Develop course curriculum, maintain scientific excellence in training, monitoring and evaluating trainees, and consult on
epidemiological methods.""",Guideline,"Schneider D, Evering-Watley M, Walke H, Bloland PB",2011,checked,,All,checked,BF03391627.png (https://dl.airtable.com/.attachments/f312911084f19d97b8a08ffcbc93b231/ea63210b/BF03391627.png)
"Hani Mahmoud, RTSL",TEPHINET Member Programs at a Glance.pdf (https://dl.airtable.com/.attachments/65898b5f6768e690e1cbe1a99b3beeae/70c40f91/TEPHINETMemberProgramsataGlance.pdf),TEPHINET Member Programs,List/overview of 71 global field epidemiology training programs.,Human Resources,"""10.4 Evaluate existing field or applied epidemiology programmes in the regional context and identify the host country where
national public health professionals can be sent for training.""",Guideline,TEPHINET,2019,,,All,checked,TEPHINET Member Programs at a Glance.png (https://dl.airtable.com/.attachments/a7bbb2328a8f7b4504891c709568ee23/739cdd8a/TEPHINETMemberProgramsataGlance.png)
"Hani Mahmoud, RTSL",phr123S10028.pdf (https://dl.airtable.com/.attachments/c19c0179c8f4a325f2ed27a183ffa36b/5cba3f79/phr123S10028.pdf),Replicating success: developing a standard FETP curriculum,This article describes the process that was used to develop a standard curriculum based on 15 public health competencies.,Human Resources,"""10.4 Develop course curriculum, maintain scientific excellence in training, monitoring and evaluating trainees, and consult on
epidemiological methods.""",Guideline,"Traicoff DA, Walke HT, Jones DS, Gogstad EK, Imtiaz R, White ME",2008,checked,,All,checked,phr123S10028.png (https://dl.airtable.com/.attachments/9678e14e192fc72e980e4080f14bde6f/ed2463d6/phr123S10028.png)
"Hani Mahmoud, RTSL",Global_Health_FINAL_REPORT.pdf (https://dl.airtable.com/.attachments/fa47a61c06126465bdd2818383b3a7e1/744e5b9a/Global_Health_FINAL_REPORT.pdf),"Scaling Up, Saving Lives",This report calls for a rapid and significant scaling up of the education and training of health workers as part of a broader effort to strengthen health systems and highlights the importance of training to meet a country’s own health needs.,Human Resources,"10.3 Identify and address training needs for various professions/cadres.,""10.1 Build planning capacity to develop or improve human resources for health policy and strategies that quantify health
workforce needs, demands and supply under varied future scenarios."",10.1 Monitor and evaluate the implementation of the multisectoral workforce strategy to track progress and barriers.,""10.1 Map and align investment in human resources for health with the current and future needs of the population and health
systems to address shortages and enhance distribution of health workers, to enable maximum improvements in health
outcomes, social welfare, employment creation and economic growth (Global Strategy on HRH 2030 Obj2).""",Guideline,Global Health Workforce Alliance Task Force for Scaling Up Education and Training for Health Workers,2008,checked,,"Ch 3/4, Ch 8, Ch 7, Ch 5",checked,Global_Health_FINAL_REPORT.png (https://dl.airtable.com/.attachments/9b167ae7e376e2bbd26eaa0411a39c74/6625eebf/Global_Health_FINAL_REPORT.png)
"Hani Mahmoud, RTSL",FETP_development_handbook_508.pdf (https://dl.airtable.com/.attachments/ea560a5d275b329136ea477b8e91205e/b16c36d1/FETP_development_handbook_508.pdf),Field Epidemiology Training Program Development Handbook,Complete Guideline for developing field epidemiology training programs,Human Resources,"10.4 Review and document current field epidemiology capacity in the country.,10.4 Conduct recruitment and selection of participants for field or applied epidemiology training in host country.,""10.4 Develop a strategic plan for development of field or applied epidemiology program that includes an advisory group and
governance structure with stakeholders, that allows the development of goals and objectives of national (or participation in
regional) applied epidemiologists."",""10.4 Identify a sustainable funding mechanism for field or applied epidemiology; consider basic level field or applied
epidemiology with a plan for expansion into intermediate and advanced levels of field or applied epidemiology, as
determined by country needs."",""10.4 Develop course curriculum, maintain scientific excellence in training, monitoring and evaluating trainees, and consult on
epidemiological methods."",""10.4 Monitor and evaluate the performance of the epidemiology workforce within healthcare systems including veterinary
services.""",Guideline,US CDC,2006,checked,,"Ch 2,Ch 4.1,Ch 3,Ch 6,Ch 5,Ch 8",checked,FETP_development_handbook_508.png (https://dl.airtable.com/.attachments/0d12e515233e2aec4b9f53c6ab16d280/4edea301/FETP_development_handbook_508.png)
"Hani Mahmoud, RTSL",RAND_WR581.pdf (https://dl.airtable.com/.attachments/2a4bb3c31d1522d6f9eae1e5648efc89/0b1c285b/RAND_WR581.pdf),"Enhancing Emergency Preparedness, Response, and Recovery
Management for Vulnerable Populations: Literature Review","This literature review seeks to describe promising communication strategies for public health emergency
risk communication, summarize the quality and content of the existing peer-reviewed literature, and identify gaps in knowledge.",Risk Communication,"15.3 Develop a plan to engage key stakeholders at the national level.,15.3 Identify focal points for community engagement at the national and subnational levels.",Guideline,"Beckjord EB, Stern SA, Meredith LS, et al",2012,,,All,checked,
"Hani Mahmoud, RTSL",su6503a10.pdf (https://dl.airtable.com/.attachments/b6d3c8d54f40da6c969ae4f3c1fe59d8/98b7e69c/su6503a10.pdf),"Lessons of Risk Communication and Health Promotion — West Africa
and United States",This article discusses the risk communication strategies used by the U.S. CDC in West Africa and the United States during the 2014-2016 Ebola epidemic and concludes with a summary of the lessons learned.,Risk Communication,"""15.2 Identify ministries, organizations and key stakeholders involved in risk communication and community engagement."",""15.2 Consult with and conduct initial meeting with identified organizations and ministries to define coordination mechanisms and
platforms at national and subnational levels.""",Case Study,"Bedrosian SR, Young CE, Smith LA, et al.",2016,checked,,All,checked,
"Hani Mahmoud, RTSL",acprof-9780199562848-chapter-05.pdf (https://dl.airtable.com/.attachments/eaa2b05da952c52f87df35b6379e2a89/fa40b567/acprof-9780199562848-chapter-05.pdf),Risk Communication and Public Health,"This book covers the theoretical and research background on risk communication, presents a wide range
of contemporary case studies, and concludes with an analysis of the lessons learned and recommendations for the future.",Risk Communication,"""15.2 Expand information sharing mechanism with other sectors including media, civil society and the private sector.""",Manual,"Bennett P, Calman K, Curtis S, Fischbacher-Smith D. ",2010,,,Ch 5,checked,
"Hani Mahmoud, RTSL",Best Practices in Public Health Risk and Crisis Communication.pdf (https://dl.airtable.com/.attachments/a357688e7f69060c4f136a679aacc003/ac2d08cb/BestPracticesinPublicHealthRiskandCrisisCommunication.pdf),Best Practices in Public Health Risk and Crisis Communication,This article presents a checklist of best practices that should be considered for public health risk and crisis communication plans.,Risk Communication,"15.1 Train frontline healthcare staff on effective risk communication.,""15.2 Establish objectives, communication flow charts, SOPs and ways of working between units, agencies/organizations, for risk
communication and community engagement."",""15.3 Develop tools, procedures and methods for community engagement to obtain community feedback through surveys,
hotlines, community dialogue or other means."",""15.1 Communicate in local languages and use appropriate technology for information exchange (dissemination and receiving
feedback from the public).""",Manual,Covello VT,2003,checked,,All,checked,
"Hani Mahmoud, RTSL",Dickmannetal2015Evaluationframework.pdf (https://dl.airtable.com/.attachments/0aa1981fb919f97cf364932b929d8f8a/6c5cd1bc/Dickmannetal2015Evaluationframework.pdf),"Making sense of communication
interventions in public health emergencies – an evaluation framework for risk communication.","This article proposes framework for the evaluation of risk communication strategies that espouses an understanding of risk communication as an interactive, holistic, continuous and engaging activity that focuses on dialogue, intelligence gathering, and building relationships",Risk Communication,"""15.1 Establish monitoring and evaluation tools to evaluate the implementation of risk communication activities during public
health emergencies.""",Case Study,"Dickmann P, McClelland A, Gamhewage GM, Portela de Soua P, Apfel F.",2015,checked,,All,checked,
"Hani Mahmoud, RTSL",2017_Health_related_disaster_comm_and_social_media.pdf (https://dl.airtable.com/.attachments/dbd5acc21af419effed64a3cdd2ca452/a38cdd7a/2017_Health_related_disaster_comm_and_social_media.pdf),Health-Related Disaster Communication and Social Media: Mixed-Method Systematic Review,This review examines the body of literature on the best social media practices to promote health protection and dispel misinformation during disasters.,Risk Communication,"""15.3 Establish mechanisms for systematically receiving community feedback through multiple channels including social media
and direct dialogue.""",Case Study,"Eckert S, Sopory P, Day A, et al.",2018,checked,,All,checked,
"Hani Mahmoud, RTSL",1471-2458-14-484.pdf (https://dl.airtable.com/.attachments/9397fc07c6dea5fff7270c057e263462/2e289440/1471-2458-14-484.pdf),"What have we learned about communication inequalities during the
H1N1 pandemic: a systematic review of the literature",This literature review characterizes the scientific literature that examined issues related to communications to the public during the H1N1 pandemic.,Risk Communication,"""15.3 Conduct a needs analysis for effectively engaging with civil society groups and key nongovernmental organizations (including
female-oriented organizations), and religious and traditional leaders at the national level.""",Case Study,"Lin L, Savoia E, Agboola F, Viswanath K",2014,checked,,7-11,checked,
"Hani Mahmoud, RTSL",1-s2_0-S0277953606004060-main.pdf (https://dl.airtable.com/.attachments/c1cc84b4ab264296df37cbc949451ef3/d3b804e6/1-s2_0-S0277953606004060-main.pdf),"Responding to global infectious disease outbreaks: lessons from SARS on the role of risk perception, communication and management","This article examines the role that risk, and especially the perception and communication of risk played in
driving the economic impact of 2003 SARS outbreak.",Risk Communication,"""15.1 Develop a mechanism to conduct baseline surveys on knowledge, attitudes and practices on priority health threats and on
health seeking practices.""",Guideline,Smith RD,2006,checked,,All,checked,
"Hani Mahmoud, RTSL",Q9-Final-Report.pdf (https://dl.airtable.com/.attachments/625694073fc3703c02468e0ca4086af8/9e4bff49/Q9-Final-Report.pdf),"What are the best ways to engage communities in emergency risk
communication activities to respond to events/ contexts?","This literature review summarizes the best practices for engaging communities, in preparing for and responding to emergencies with public health implications",Risk Communication,"""15.3 Conduct a needs analysis for effectively engaging with civil society groups and key nongovernmental organizations (including
female-oriented organizations), and religious and traditional leaders at the national level."",15.3 Identify focal points for community engagement at the national and subnational levels.",Guideline,"Sopory P, Wilkins L, Day A, et al",2016,checked,,29-49,checked,
"Hani Mahmoud, RTSL",Emergency Risk Communication Lessons Learned from a Rapid Review of Recent Gray Literature on Ebola Zika and Yellow Fever.pdf (https://dl.airtable.com/.attachments/4e12cecc85b0e769e333830d23743e83/b1d51ffc/EmergencyRiskCommunicationLessonsLearnedfromaRapidReviewofRecentGrayLiteratureonEbolaZikaandYellowFever.pdf),"Emergency Risk Communication: Lessons Learned from a Rapid
Review of Recent Gray Literature on Ebola, Zika, and Yellow Fever","This rapid review focuses exclusively on gray literature and seeks to identify the lessons learned from
recent Ebola, Zika, and yellow fever to improve emergency risk communication.",Risk Communication,"""15.1 Communicate in local languages and use appropriate technology for information exchange (dissemination and receiving
feedback from the public)."",""15.1 Develop a mechanism for systematically collecting feedback from the community (such as through telephone hotline, social
media forums, direct engagement)."",15.3 Identify focal points for community engagement at the national and subnational levels.",Case Study,"Toppenberg-Pejcic D, Noyes J, Allen T, et al.",2019,checked,,439-443,checked,
"Hani Mahmoud, RTSL",GW-Report-Ebola-Risk-Communication-Project-LIberia_Lessons-in-Crisis-Communication1.pdf (https://dl.airtable.com/.attachments/e628985e63edbfab6f111954bbcf95b6/d2078739/GW-Report-Ebola-Risk-Communication-Project-LIberia_Lessons-in-Crisis-Communication1.pdf),Ebola risk communication project in Liberia: Lessons in crisis communication,This report seeks to summarize and to discuss the types and qualities of Ebola-related communication strategies used in Liberia during the 2014-2016 Ebola epidemic.,Risk Communication,"""15.2 Establish objectives, communication flow charts, SOPs and ways of working between units, agencies/organizations, for risk
communication and community engagement."",""15.1 Communicate in local languages and use appropriate technology for information exchange (dissemination and receiving
feedback from the public).""",Case Study,"Turner MM, Shaikh H, Rimal RN",2016,,,79-85,checked,
"Hani Mahmoud, RTSL",cerc_2014edition.pdf (https://dl.airtable.com/.attachments/202b51a1a9bf4be2a04430d0c1a09f2b/4dc44ab9/cerc_2014edition.pdf),"Crisis and Emergency Risk Communication (Manual):
Second Edition",This guidance document introduces the principles of and practical tools for risk communication during a crisis or emergency.,Risk Communication,"15.1 Identify and assign spokespersons (holding a certain job position) for public health emergency.,""15.1 Establish a list of key stakeholders in government ministries and among implementing partners. Identify points of contact
for communication including different means for internal information sharing (such as by email, SMS or phone or closed
group social media platforms)."",""15.2 Identify ministries, organizations and key stakeholders involved in risk communication and community engagement."",""15.1 Develop a national multihazard, multisectoral emergency risk communication plan."",""15.3 Conduct a needs analysis for effectively engaging with civil society groups and key nongovernmental organizations (including
female-oriented organizations), and religious and traditional leaders at the national level."",""15.2 Expand information sharing mechanism with other sectors including media, civil society and the private sector."",""15.1 Communicate in local languages and use appropriate technology for information exchange (dissemination and receiving
feedback from the public).""",Guideline,US CDC,2014,checked,,"Ch5,Ch7,Ch7,Ch4,Ch4,Ch6,Ch8/9",checked,
"Hani Mahmoud, RTSL",WHO_ZIKV_RCCE_16_1_eng.pdf (https://dl.airtable.com/.attachments/27bc829dc977f92e3ce8c99155f749d0/60f09049/WHO_ZIKV_RCCE_16_1_eng.pdf),Risk communication in the context of Zika virus,This document is an example of interim guidance for effective risk communication for Zika virus transmission and potential complications from infection.,Risk Communication,"""15.1 Communicate in local languages and use appropriate technology for information exchange (dissemination and receiving
feedback from the public).""",Guideline, World Health Organization,2016,checked,,All,checked,
"Hani Mahmoud, RTSL",9789241597449_eng.pdf (https://dl.airtable.com/.attachments/eb8ba71782b7cbccbd87b11d1b7e15f7/7a9ca01c/9789241597449_eng.pdf),Outbreak communication planning guide,This document seeks to provide guidance to help national authorities apply the World Health Organization outbreak communication principles to outbreak planning and preparation activities.,Risk Communication,"""15.1 Develop a national multihazard, multisectoral emergency risk communication plan."",""15.1 Develop a mechanism for systematically collecting feedback from the community (such as through telephone hotline, social
media forums, direct engagement).""",Guideline, World Health Organization,2008,checked,,All,checked,
"Hani Mahmoud, RTSL",WHO_CDS_2005_32web.pdf (https://dl.airtable.com/.attachments/828cecef406f4e7b845e67161f8c0090/121d7b8f/WHO_CDS_2005_32web.pdf),Best practices for communicating with the public during an outbreak,This report describes infectious disease outbreaks and the many difficult challenges they present for communicators and identifies best practices for communication during an outbreak.,Risk Communication,15.3 Develop and disseminate training on community engagement at the national and subnational levels.,Guideline, World Health Organization,2005,checked,,All,checked,
"Hani Mahmoud, RTSL",WHO_CDS_2005_31_eng.pdf (https://dl.airtable.com/.attachments/10cff7e15e53676eb4d41aab115bfa02/bb10ed4a/WHO_CDS_2005_31_eng.pdf),Effective Media Communication during Public Health Emergencies,"This guidance describes a seven-step process to assist officials and others to communicate effectively
during emergencies.",Risk Communication,"15.1 Identify and assign spokespersons (holding a certain job position) for public health emergency.,""15.1 Develop a national multihazard, multisectoral emergency risk communication plan."",""15.2 Identify ministries, organizations and key stakeholders involved in risk communication and community engagement."",""15.3 Establish a list of key stakeholders � civil society groups, key nongovernmental organizations, key religious and traditional
leaders � at the national level."",""15.3 Establish mechanisms for systematically receiving community feedback through multiple channels including social media
and direct dialogue.""",Guideline, World Health Organization,2005,checked,,"Step 3,Step 2,Step 4,Step 4,Step 5",checked,
"Hani Mahmoud, RTSL",Africa CDC EBS Framework - EN.pdf (https://dl.airtable.com/.attachments/49b0aa4ed1d285a478271a71ac85176e/8b9c99c9/AfricaCDCEBSFramework-EN.pdf),Africa CDC Framework for Event-based Surveillance,This guidance document is intended to serve as an outline that can guide stakeholders interested in implementing event-based surveillance.,Surveillance,"""9.1 Establish event-based surveillance: Establish systems to identify potential events from various other sources (such as media, social media, private sector)."",""9.1 Establish event-based surveillance: Establish a process to identify potential events from communitybased reporting (people identified from the community, verification teams at facilities identified, SOP and flow of information available) and make the data available at all needed levels.""",Guideline,Africa Centres for Disease Control and Prevention,2018,checked,,"All, Module 5/Module 2.2",checked,
"Hani Mahmoud, RTSL",hs_2018_0066.pdf (https://dl.airtable.com/.attachments/643858d61d01287925c3f6841d57d004/2fb9410d/hs_2018_0066.pdf),"Factors Influencing Community Event-based Surveillance: Lessons Learned from
Pilot Implementation in Vietnam","The article describes lessons learned from the implementation of a pilot community event-based surveillance system – the lessons are now being used by the ministry of health in the national scale-up of
the program.",Surveillance,"""9.1 Establish event-based surveillance: Establish a process to identify potential events from communitybased reporting (people identified from the community, verification teams at facilities identified, SOP and flow of information available) and make the data available at all needed levels.""",Example,"Clara A, Dao ATP, Do TT, et al.",2018,checked,,All,checked,
"Hani Mahmoud, RTSL",17-1851.pdf (https://dl.airtable.com/.attachments/ea71c217038e933d5e97867d6b9ea55d/e3982c0c/17-1851.pdf),"Event-Based Surveillance at Community and Healthcare Facilities, Vietnam","This article discusses the pilot of a community event-based surveillance system that resulted in the early
detection and reporting of outbreaks, improved collaboration between relevant sectors, and increased community participation in surveillance and reporting.",Surveillance,"""9.1 Establish event-based surveillance: Establish a process to identify potential events from communitybased reporting (people identified from the community, verification teams at facilities identified, SOP and flow of information available) and make the data available at all needed levels.""",Example,"Clara A, Do TT, Dao ATP, et al.",2017,checked,,All,checked,
"Hani Mahmoud, RTSL",f680460c-f970-48de-a969-e739ed2964f1.tmp (https://dl.airtable.com/.attachments/6f4abc57311ab402ca02748b804eb729/38df6dc8/f680460c-f970-48de-a969-e739ed2964f1.tmp),Early warning epidemic surveillance in the Pacific island nations: an evaluation of the Pacific syndromic surveillance system,"This evaluation assess whether the a surveillance system is meeting its objectives, examines progress made since its last evaluation, and provides recommendations to enhance future performance..",Surveillance,"""9.1 Develop national communicable disease surveillance strategy based on IHR requirements, which includes a list of priority/epidemic-prone diseases and syndromes most relevant to the country.""",Example,"Craig AT, Kama M, Samo M, et al",2016,checked,,All,checked,
"Hani Mahmoud, RTSL",WPSAR_2013_4_3-019.pdf (https://dl.airtable.com/.attachments/d66f5422a91f8ee8a215bddc6dc68185/1b0f9afe/WPSAR_2013_4_3-019.pdf),"Event-based surveillance in Papua New Guinea: strengthening an
International Health Regulations (2005) core capacity","This article reviews the event-based surveillance system of Papua New Guinea and evaluates its performance from 2009 to 2012, sharing lessons that may be useful to other low-resource public health practitioners working in surveillance",Surveillance,9.1 Establish event-based surveillance: Develop guidelines and standard operating procedures for eventbased surveillance.,Example,"Dagina R, Murhekar M, Rosewell A, Pavlin BI",2013,checked,,All,checked,
"Hani Mahmoud, RTSL",CommunityBasedSurveillance_Global-LR.pdf (https://dl.airtable.com/.attachments/b39bec1a61475f7666717cc306fc4742/47a4ba4a/CommunityBasedSurveillance_Global-LR.pdf),"Community-Based Surveillance: guiding
principles",This document outlines the principles used by the IFRC to implement community based surveillance and empower communities to play an essential role in their own health security.,Surveillance,"""9.1 Establish event-based surveillance: Establish a process to identify potential events from communitybased reporting (people identified from the community, verification teams at facilities identified, SOP and flow of information available) and make the data available at all needed levels.""",Guideline,International Federation of Red Cross and Red Crescent Societies,2017,checked,,All,checked,
"Hani Mahmoud, RTSL",EMHJ_2019_25_01_58_65.pdf (https://dl.airtable.com/.attachments/ee23478259e5f80351894e5ab7cd37b7/670eba5c/EMHJ_2019_25_01_58_65.pdf),"Enhancing surveillance for early detection of Zika virus infection:
strategies for the countries of Eastern Mediterranean Region","This study discusses appropriate surveillance strategies and frameworks for the detection of Zika virus infection (which, may also apply to other diseases carried by Aedes mosquitoes)",Surveillance,"""9.1 Establish event-based surveillance: Develop and put in place case definitions and the process of detection, assessment and reporting of the event (clusters or outbreaks) for country priority diseases and disseminate to national and subnational levels.""",Example,"Obtel M, Malik MR, Nguyen TMN, et al",2019,checked,,All,checked,
